,query,text,url
5,APT1,"Chinese Whispers, Chinese Lies: Analyzing Mandiant's APT1 Report

In the weeks since the Mandiant APT1 Report was released, the conclusions presented by Mandiant have been extensively repeated and commented on by pretty much everyone. Worryingly, the narrative was accepted almost unequivocally, brushing aside many inconsistencies and disregarding any opposing interpretations. In the case of most of the commentators, it appeared they had either only briefly skipped through or not even read the original report.
What struck me and many others as most suspicious, were the glaring operational security lapses that this supposedly “highly professional” hacking group seems to have made over the course of several years. Most obvious is the continued use of the “hugesoft.org” domain name.

We are meant to believe that a covert, special operations team member was allowed to bring with him a tainted domain from his civilian, cybercrime days. What that would indicate is that in this vast, huge group (Mandiant alleges several hundred or even thousands) no one knows anything about operational security procedures, such as executing regular reviews for example, that would and should have eventually made the Comment Crew themselves aware of these smoking guns. The group evidently has sufficient knowhow and is able to use OSINT to construct targeted attacks and provide them with situational awareness to operate, yet appears to be unable to cover their tracks.
We are also told that APT1 was so careless or brazen, depending on the interpretation, that they habitually entered partially correct information for domain registration data, even using email addresses that could be Google’d or traced using OSINT methods. Not consistently though – only sometimes. At other times, they made them up.
The analysis of the WHOIS records by Mandiant was hilarious. On Page 47 (PDF), we are treated to the ludicrous assumption that the spelling, of all things, of the fake registry information is of any consequence. All it shows is that whoever did it did not care about the accuracy of the contents of a fake dns registration. Because it’s fake, duh. Mandiant’s conclusion is again, comical:
Uncoordinated DNS registration campaign – where some registrants fabricated fake data and others did not. What is that even supposed to mean? An “uncoordinated campaign” is something of an oxymoron anyway.
The report lists many domains that were spotted by Mandiant. The only problem is that they are consolidated, and not listed or sorted in any way that allow a 3rd party to recognize in which context, constellation and grouping they were actually originally identified. This is disingenuous, because it means that it is not transparent whether the attribution of all of these to one individual group is correct, or if there were other patterns within the individual incidents. Essentially, the veracity of the claim that all of these domains belong to one group is something we have seen no actual evidence for. It is based solely on word of mouth. Of course, many of these can be verified by other 3rd parties, and has been done, but not all of them together. That can give the false impression that the Indicators of Compromise have been verified.
The indicators tying the Comment Crew to PLA Group 61398 are also tenuous, so tenuous that if you plucked them with your finger, they would probably tear. The Information on PLA Group 61398 is undisputable. There is absolutely no doubt that this group exists. What is in question however, is that the group identified (although even the evidence that the activity is solely of one group is questionable) as the Comment Crew are in fact one and the same. Mandiant provides nothing in hard evidence, instead stringing together coincidences and leaps of logic that would seem more at home on a conspiracy forum.
Most of the characteristics that match (Page 59, Table 12, Matching Characteristics) between APT1 and Unit 61398 would apply almost to any active Hacking Group. It is like identifying a murderer by saying that murderers have 2 arms, 2 legs, and kill people, hence so-and-so did it.
Even the geographical attribution is unreliable in the sense that there could be other hacking groups acting in such a vast and populated area, that has a population of over 5 million, is home to several thousand businesses and 2 universities. In the same vein, you could attribute any hack originating in London to the UK Ministry of Defense.
These are the main points that the entire synopsis of the Mandiant Report hinges on. It is also worth pointing out that many of the subsequent conclusions are based on huge leaps of faith and many assumptions. In addition, much of the report is filled with information and OSINT sources that only corroborate and strengthen the evidence for the existence of the Comment Crew, and the existence of PLA Unit 61398, but not that they are indeed one and the same.
There is one secondary indicator that has been made a great deal of. On page 52, the report cites an incident involving the actor identified as “Ugly Gorilla” in 2004, who asked a prominent Professor whether China had a “cyber army”. Whilst an interesting find, it really proves very little in the way of any association between “Ugly Gorilla” and the PLA, but keep a mental note of it, as we will revisit it later.
I am a great believer in the principle of Occam’s Razor. Whatever hypothesis makes the least assumptions is the most likely. Applying that to many of the findings in the Mandiant Report and the narrative that was provided as an explanation seems prone to relying on too many assumptions.
The problems identified with the report have not been entirely overlooked. Considering the obvious lapses in operational security that the alleged Comment Crew displayed even Mandiant has conceded in the meantime that the Crew is not China’s “A-Team”. No kidding, Sherlock! It is in fact well known that China has some operational offensive cyber-teams of a high caliber. In this of course, they are not alone. According to Mandiant:
Applying Occam’s razor here again: Why would the Chinese have these elite groups that appear to work without leaving anywhere near as many traces, and then instead let the B-List go on a rampage doing most of the work? Even if it is argued that it is a matter of resources, it seems unlikely that these teams would not, over time, train the others, or that Operational Security Procedures, Tools and Knowhow would be shared.
When pressed if the Comment Crew were more “regimented” than a group of freelancers, Richard Bejtlich, the CEO of Mandiant retorts, “Other units are more regimented and have better opsec [or operational security,] and that’s why we didn’t talk about them.”
It seems just a little bit as though Mandiant caught a Minnow, and back at the pub with each telling the arms go wider apart taking on the size of a pike. Not to trivialize the damage done, but one needs to keep in mind that the Comment Crew in particular used a lot of off-the-shelf tools and relied far less on 0days than the more sophisticated groups, not to mention the less than stellar OpSec, leaving a trail like bull in a China shop (obligatory pun intended).
Even latest finding, of old blog entries from an individual purported to be a member of PLA Group 61398 and the Comment Crew, whilst sounding plausible at first glance makes you scratch your head in wonderment once you think about it. How was it possible that this individual was able to post this information on a public blog for so many years, without arousing the attention of his colleagues, superiors, or any of the other various organs of the Peoples Party that otherwise monitor and censor all else. Even project details are disclosed. There are examples of information being censored for far less.
This is the problem when you are trying to match the evidence against a foregone conclusion. We like to compare this to solving a jigsaw puzzle, which is a bad analogy. You always know what a jigsaw puzzle looks like before, and just try to fit the pieces to make that picture. This is more like a riddle, where you are given clues that are meant to lead to the answer. I am not in any way saying that the good folks at Mandiant are up to anything sinister or are colluding with anyone , far from that. The release of the Indicators of Compromise were a boon to the entire community, and their technical ability is undoubtedly of the highest quality and caliber. But we are all human and cannot overcome our personal and innate preconceptions and preconceived notions. The technical work was excellent-- the drawing of conclusions less so.
There are far too many assumptions there for it to be the most likely explanation. Occam’s razor states that these guys are not military grade. That is the only possible conclusion based on all the evidence there currently is.
The foremost problem with the Mandiant report is that it relies on a view of China and the Chinese Cyber-Operations that has very little to do with situational conditions on the ground. It clings on to the stereotype of a regimented, centralized China with total top down control. If that China ever existed, that is certainly not the case now.
If you have followed the news and reports coming out from China the past years, and especially the last months, you will have heard of widespread governmental and industrial and economic corruption. This corruption is endemic and the main driver behind the prolific hacking. The majority of the hackers are indeed freelancers, paid bonuses and fees for valuable information. There is evidence to support this, with instances of alleged Chinese government operations being found hosted side by side with criminal activities. Once again, a surefire sign that military or intelligence services operational security are not being followed by these kinds of threat actors. The risk of losing operational integrity is too high.
Even the prevailing and popular theory that these freelancers are in the employ of the Chinese government is often incorrect and ignores the scale and specific Chinese character of the corruption. A recent report in the China Digital Times provides a behind the scenes look into how espionage and surveillance are used in internecine infighting in local, regional and possibly even national government, politics, and economics. It is a definite recommended must read. Espionage has become a tool of choice in China when doing business and a common weapon to get ahead in your career.
Essentially, there are many, many parties who will make use of these types of services, the majority of them without any Peoples Party or PLA authority, or even their knowledge. Businesses competing in this environment will also use any means possible to get or stay ahead.
In this environment, hackers can take on contracts from many of the parties participating in this activity, going either after specific targets or information, selling opportunistic pay data to multiple customers, or if the data is valuable enough, to the highest bidder.
What this really means though, is that when the Chinese government states that it is not behind most of these attacks – it is possibly telling the truth. That the Chinese government has offensive cyber capabilities are not disputed – most governments now have these, or are planning on adding them. What is not a given is that all of this activity has been officially prompted or sanctioned.
As well as commercial freelancers plying their trade to anyone willing to pay, there are dedicated groups financed and set up by unsanctioned individuals and interest groups, working specifically to further private interests. The line between government and private interests, due to the innate nature of the power structures in China, are often blurry to the point of being unrecognizable.
One thing to note is that the hacking is also indiscriminate; they target each other as much as international targets.
Add to this the fact that other actors, and other nation states amongst them, use china as a jumping –off point, and the result is pandemonium and chaos. It’s the wild, wild east.
Coming back to the incident with “Ugly Gorilla” and his public query that some have interpreted as the possible first contact between the PLA and UG, it is just as likely that a private entity could have reached out and made contact. Amongst the many OSINT sources dug up so far in regards to the identified members of the Comment Crew, attempts at finding employment seem to figure prominently. That too indicates a burgeoning market for hackers for hire. If it was only the government employing hackers, publicly seeking work would seem moot.
The reason then, why the Comment Crew, and such groups in general, are so successful; have perfected and evolved their infrastructure, techniques and toolsets; have been able to obtain the resources and longevity and maintain their focus in such a way that many observers think they are nation-state sponsored is because they have an economic environment that makes this possible. They are able to convert much of the data they exploit into hard cash and other income, and in a location like the industrial hub Pudong they have quick and easy access to office space, infrastructure, human resources, and as an added bonus occasionally get to rub shoulders with the national intelligence community at lunch. The same environmental factors that make Pudong attractive to the actual PLO Group 61398 would more than likely make it suited for similar operations, be they military and private.
Ron Gula, the CEO of Tenable Network Security, remarked to me recently that it sounded reminiscent of the KGB Hackers, whose story is recounted in Clifford Stoll’s wonderful account of how he traced this group and singlehandedly invented the discipline of computer forensics, “The Cuckoo’s Egg”. The KGB Hackers were primarily a group of German hackers led by Karl Koch acting under the alias Hagbard. They spied for the KGB in the late 1980’s, targeting European and US defense installations and contractors. Supplied with Cash payments and drugs amongst other things by their Russian handlers, they were able to carry out hacks with all of their attention full time. Of course, the people supplying the money need not necessarily be from the government. Anyone with deep pockets and a need for the information available via these means will suffice.
One may argue that my narrative has little evidence – to which I would counter that I have just as much as Mandiant. For that though, mine at least is based on situational awareness and a more realistic set of assumptions. Other commentators have come to similar conclusions as well.
For the Chinese government the problem is that it cannot acknowledge this state of affairs publicly or officially – not just because they may lose face – but also because corruption is such a touchy subject and has become a major problem and social issue in the Peoples Republic. In addition, many of the interest groups that are benefitting from these activities have a stake in the government and judging by other behavior will work against any attempt to limit them.
It remains to be seen if this activity will – or even can – be reined in by the Chinese government. It is questionable how much influence the leadership has on this behavior, or if it can do anything that will be effective at all, when it is so widespread, against intent and without official sanction anyway.
The announced crackdown on corruption by the new leadership may be the best hope and may have more of an impact than targeting the hacking market by itself, should it prove to be a heartfelt attempt and be in any way effective. The danger in the meantime though, is that the incessant offensive activity originating out of Chinese cyberspace, whether state-sponsored or the result of criminals and corruption, will lead to an escalation and a cyber-arms race. Calling for international agreement on offensive operations in cyberspace will do little to curb the shadow activity emanating from China. The government will have to take serious and effective action or the economic repercussions will outweigh any benefits deriving from engaging in espionage, as well as the cost required to control it. It would also have the benefit of reducing the noise that currently allows other actors to use Chinese IP-Space as a decoy to hide their own tracks.
So does this alternative interpretation change anything? Probably not for past, present and future victims. The Modus Operandi remains the same, and the primary concern for them is still damage limitation and the loss of data and competitiveness. But, it is relevant to policy makers and businesses intending on operating in China. It impacts how we have to interact with the Chinese government on this, and should also redefine our expectations.
Related Reading: A Convenient Scapegoat - Why All Cyber Attacks Originate in China",https://www.securityweek.com/chinese-whispers-chinese-lies-analyzing-mandiants-apt1-report
6,APT1,"China's APT1 Still Operating With the Same Modus Operandi

According to researchers at Cyber Squared, the group APT1, as named by Mandiant earlier this year, is up to their same old tricks. Despite being outed after attacks against the New York Times and the Wall Street Journal, they have not changed tactics.
Two months ago, the APT1 group (a.k.a. “Comment Crew”) was the center of attention after being named in a Mandiant report. The intelligence firm was called in to investigate the security incidents the New York Times and the Wall Street Journal, and in a report said that APT1 was the “...2nd Bureau of the People’s Liberation Army (PLA) General staff Department’s (GSD) 3rd Department, commonly known by its Military unit Cover Designator (MUCD) as Unit 61398.”

According to their report, Mandiant said that they were able to confirm 937 C&C servers, running on more than 800 distinct IP addresses. Further, the firm said that APT1 has had more than 2,500 domains attributed to them in the last several years.
“Our research and observations indicate that the Communist Party of  China is tasking the Chinese People’s Liberation Army (PLA) to commit systematic cyber espionage and data theft against organizations around the world,” Mandiant’s report alleged.
In the aftermath of that news cycle, it was expected that APT1 would disappear, or at the least they would shift gears and change their tactics, tools, and procedures (TPPs). As it turns out, that isn’t the case.
“As of late April 2013, Chinese cyber espionage threat groups have clearly continued their activity. In the example given below, we will highlight that “Comment Crew” is still conducting exploitation operations. In fact, there has been little change,” a blog post by Cyber Squared explains.
While it is possible that the group is also using newer capabilities, the post explains, that they haven’t stopped using the methods they’re known for is concerning. Cyber Squared postulated that the group may have achieved “a satisfactory balance of conducting successful exploitation operations” with their existing infrastructure and methods, while implementing additional evasion techniques.
“The totality of evidence leads us to believe that that “Comment Crew” is still in the game and up to their old tricks, using familiar tactics to target their victims. The February disclosure appears to have done little to stem the onslaught of cyber espionage from this or other Chinese threat groups,” the post concluded.
Additional details and the full report can be seen here. 
Related: Lessons from Mandiant’s APT1 Report",https://www.securityweek.com/chinas-apt1-still-operating-same-modus-operandi
7,APT1,"FireEye Denies Hacking Back Against Chinese Cyberspies

In his latest book, New York Times correspondent David Sanger describes how cybersecurity firm Mandiant hacked into the devices of Chinese cyberspies during its investigation into the threat group known as APT1.
Mandiant, now owned by FireEye, published its famous report on APT1 back in 2013 when it was led by CEO Kevin Mandia. The company at the time released information apparently showing that the Chinese military had been conducting sophisticated cyber-espionage operations.
In his book, “The Perfect Weapon: War, Sabotage, and Fear in the Cyber Age,” Sanger describes how he was allowed to watch Mandiant hack into the hackers’ systems. An excerpt of Sanger’s book shared on Twitter by Thomas Rid, a Professor of Strategic Studies at Johns Hopkins University, reads:
In a statement published on Monday, FireEye admitted that Sanger was given access to the methods used by Mandiant to gather evidence of APT1’s ties to the Chinese military, but claims the reporter’s description “resulted in a serious mischaracterization of our investigative efforts.”
“We did not do this, nor have we ever done this,” FireEye said regarding claims that its employees activated the cameras on the hackers’ own laptops. “To state this unequivocally, Mandiant did not employ ‘hack back’ techniques as part of our investigation of APT1, does not ‘hack back’ in our incident response practice, and does not endorse the practice of ‘hacking back.’”
“Hacking back,” the term used to describe a cyberattack victim – or someone hired by the victim – hacking into the systems of the attacker, is a controversial practice and only few cybersecurity firms have admitted doing it.
FireEye claims that what Sanger described as hacking back were actually video recordings of the attackers interacting with their malware command and control (C&C) servers. The firm has published one of the videos it presumably showed the reporter.
“To someone observing this video ‘over the shoulder’ of one of our investigators, it could appear as live system monitoring. Nevertheless, Mandiant did not create these videos through ‘hacking back’ or any hacking activity. All of these videos were made through information obtained via consensual security monitoring on behalf of victim companies that were compromised,” FireEye explained.
While some industry professionals have accepted FireEye’s explanation for obtaining data on the hackers’ personal online activities, Sanger’s claims that he saw APT1 members wearing leather jackets raises a lot of questions. FireEye has not specifically addressed this issue in its statement, but SecurityWeek is trying to obtain some clarifications from the company. In the meantime, experts have provided some more or less plausible explanations on how the reporter may have seen what he believed were the hackers.

Richard Bejtlich, who worked for Mandiant and then FireEye between 2011 and 2017, including as Chief Security Strategist, has corroborated FireEye’s statement.
‘At no time when I worked for Mandiant or FireEye, or afterwards, was there ever a notion that we would hack into adversary systems,” Bejtlich wrote in a blog post. “During my six year tenure, we were publicly and privately a ‘no hack back’ company. I never heard anyone talk about hack back operations. No one ever intimated we had imagery of APT1 actors taken with their own laptop cameras. No one even said that would be a good idea.”
Related: Chinese Whispers, Chinese Lies - Analyzing Mandiant's APT1 Report
Related: Considering The Complexities of Hack Back Laws",https://www.securityweek.com/fireeye-denies-hacking-back-against-chinese-cyberspies
8,APT1,"Researchers Identify Targeted Attacks in Australia

Researchers at FireEye have identified a new targeted attack, currently hitting organizations in Australia, in order to deliver payloads designed to open remote access and steal information.
The malware discovered by FireEye goes to several lengths to remain hidden, and uses a chained process to attack its victim. According to FireEye, the victims in this attack were hand picked, with the opening stage of the attack itself coming via email.
The companies being targeted were selected for unknown reasons, but the attackers are using malicious URLs embedded within the emails that link to a C&C (Command and Control) domain that uses the name of the victim or the name of a current project that is being worked on as an attempt at legitimacy.
Once the victim visits one of the C&C domains, the host revives instructions as “base64 encoded strings using a custom character set, which is further scrambled using a custom-scrambling algorithm,” FireEye reported. 
After that, a base64-encoded executable embedded in an HTML page is downloaded and ran on the host.
“In our experiment, since the CnC was not responding, we supplied an encoded notepad.exe in the response. The malware successfully decoded notepad.exe and launched it as setup.exe on the compromised machine,” FireEye explained.
“We have observed many variants of this malware; some even try sending hostname and IP address information back to its CnC as part of its User-Agent string in the GET request. One of the variants we observed had “IPhone 8.5” in the UA string, which we found interesting.”
It’s worth mentioning that FireEye’s findings included a list of malware that was previously disclosed by Mandiant in their APT1 report. An indexed list of the APT1 malware can be seen here. ",https://www.securityweek.com/researchers-identify-targeted-attacks-australia
