,query,text,url
0,APT1,"'Operation Oceansalt' Reuses Code from Chinese Group APT1

A recently observed cyber-espionage campaign targeting South Korea, the United States and Canada is reusing malicious code previously associated with state-sponsored Chinese group APT1, McAfee reports.
Exposed in a Mandiant report in 2013 and also known as Comment Crew, APT1 was thought to be a unit of China’s People’s Liberation Army (PLA) and was considered both one of the most persistent of China's cyber threat actors and highly prolific in terms of the quantity of information it had stolen.
The newly observed campaign is unlikely the work of APT1, which has remained silent ever since the Mandiant report half a decade ago. Previously, the group had launched cyber-attacks on more than 141 U.S. companies from 2006 to 2010.
Dubbed Oceansalt, the malware implant used in the new campaign shows code similarities with a tool employed by APT1, namely Seasalt. This means that the actor behind the new operation had direct access to Comment Crew’s source code, although it was never made public.
McAfee’s report (PDF) on Oceansalt doesn’t provide a clear answer on who is behind these attacks, but notes that the code overlap could suggest that another group had access to the original code, or that it is a case of code-sharing between actors. Of course, it could also be a “false flag” operation.
McAfee’s security researchers discovered that Oceansalt was launched in five attack waves adapted to the targets.
While the first two attacks were spearfishing-based and used malicious Korean-language Microsoft Excel documents to download the implant, the third switched to Microsoft Word documents instead. Waves four and five targeted a small number of entities outside of South Korea, including the U.S. and Canada.
During the attacks, the hackers used multiple command and control (C&C) servers, showing that the campaign is active in countries such as Canada, Costa Rica, the United States, and the Philippines.
Oceansalt and Seasalt, McAfee notes, not only contain two exact same strings (Upfileer and Upfileok), but also show similarities in command handler and index table, and execute their capabilities in the same way. Furthermore, both use the exact same response codes to indicate the success or failure of command execution.
Both implants use the same codes for drive and file reconnaissance, and for the creation of reverse-shells (which are based on cmd.exe). Unlike Seasalt, however, Oceansalt uses an encoding and decoding mechanism, and a hardcoded control server address, but employs no persistence method.
According to McAfee, evidence that suggests code-sharing between Oceansalt authors and Comment Crew include the different mechanism for getting the C&C IP addresses, as well as the lack of reverse-shell capability in some Oceansalt samples, the presence of debug strings in Oceansalt, and the presence of new functions in one Oceansalt variant.
The implant, the researchers reveal, packs a broad range of capabilities to capture data from the victims’ machines, but it is only a first-stage component, with additional stages downloaded through commands. The malware, however, provides operators with the ability to perform various actions on the system.
Oceansalt includes support for a dozen commands: extract drive information, send information about a specific file, execute a command line using WinExec(), delete file, create file, get information on the running processes, terminate process, create/operate/terminate reverse shell, and test receive and send capabilities.
“Our research shows that Comment Crew’s malware in part lives on in different forms employed by another advanced persistent threat group operating primarily against South Korea. This research represents how threat actors including nation-states might collaborate on their campaigns,” McAfee concludes.
Related: Researchers Say Code Reuse Links North Korea's Malware
Related: 'GreyEnergy' Cyberspies Target Ukraine, Poland",https://www.securityweek.com/operation-oceansalt-reuses-code-chinese-group-apt1
1,APT1,"Lessons from Mandiant’s APT1 Report

Last week Mandiant released a powerful report that exposed what certainly appears to be a state-sponsored hacking initiative from China, dubbed by Mandiant as APT1. If you haven’t already, I highly encourage you to read the full report available here. The report not only provides analysis of the organization behind the attacks, but also includes a wealth of detail into specific techniques used by the groups as well as indicators that you can use in your own security practices.
In this article I will summarize some of the key indicators as well as some of the techniques that may help you find other indicators of advanced attacks in your network.
3,000 Indicators
It was certainly heartwarming to see Mandiant release a large number of very specific indicators of APT1 that security teams can put to good use. Far too often, a security vendor will report about how they uncovered a breach, but often lack the details that would help real infosec professionals to better do their job.
In this report, Mandiant has done the industry a solid by disclosing a variety of very specific indicators that they have been able to tie to APT1, including domains used by the attacking infrastructure, SSL certificates used to encrypt the attacker’s traffic, MD5 hashes of APT1 malware and a variety of other open-source “indicators of compromise”.
This provides very actionable information, but information that we all have to realize will also very short-lived. Given the sophistication of the APT1 organization, it’s quite likely that the referenced domains, hashes and certificates that were exposed have been decommissioned or will be soon. The indicators of compromise delve more deeply into the techniques of the attackers as opposed to certs and domain, which are effectively disposable.
Patterns and Techniques
Beyond the easily identifiable indicators, the Mandiant report provided insight into the lifecycle of an APT1 attack from the initial infection, escalation and ongoing theft of data.
First, as one might expect, APT1 used highly targeted spear-phishing techniques to infect a target, which included creating fake email accounts in the name of someone that the target would recognize. Secondly, the infecting files were often zipped to avoid analysis and often contained executables designed to look like pdfs.
This provides two important lessons – one technical and one practical. First, it means that when looking for advanced malware, we absolutely must look within zipped payloads. But secondly, it destroys the all-to-common idea of malware infections being the source of the “stupid user”. That’s not to say that “stupid users” don’t exist and that they don’t lead to malware infections – they certainly do on both counts. But the point is rather that highly targeted phishing can be constructed to fool even savvy well-trained users, and we can’t rely on training to solve the problem on its own. Instead, we need to proactively test and analyze content to programmatically determine if it is malicious or benign.
The report also shared that once the infection was established, the attackers would often rely on RDP (remote desktop protocol) to administer the ongoing attack. This protocol is obviously highly common on enterprise networks and allows the attacker to control the compromised machine remotely. RDP has been strongly linked to advanced attacks shared in a variety of other reports, including this year’s Verizon Data Breach Report. The lesson here is pretty clear – RDP and related protocols are one of the key tools of persistent attacks and security teams to have strict control over RDP, limiting its use to only the few users who must have it, and requiring two-factor authentication for RDP users.
APT1 also used a myriad of techniques to hide its communications with command-and-control servers. This included sharing data via HTTP, custom protocols written by the attackers, and a variety of modified protocols designed to look like normal application traffic, such as MSN Messenger, Gmail Calendar, and Jabber (a protocol used in a variety of instant messaging applications). All of these traffics were often used in conjunction with SSL to further obscure the traffic. This again highlights the need to look within SSL-encrypted traffic as well as the need to find customized traffic and unusual traffic that deviates from protocol. This is an emerging art, but certainly possible using firewalls and threat prevention solutions that finely decode network and application protocols.
Once it was time to steal data, the attackers predominantly relied on FTP. As with the infecting file, exfiltrated data was often compressed, this time mostly with RAR. FTP is very popular with malware because it is small, flexible and often allowed in networks. However, security teams should remember to closely analyze FTP and certainly take a closer look at FTP used to transport RAR files.
Learn to See What Doesn’t Belong
While the Mandiant report is incredibly illuminating, it is also not a panacea. If anything, the more we learn about sophisticated attacks the more it is obvious that security products will never be enough without security skill. Certainly, we will continue to need and use signatures and systems that can automatically block the bad things on our networks. But it is also equally clear that this alone won’t be enough. We need to actively seek out and test the unknowns in our network, whether that is anomalous traffic or unknown, potentially malicious files.
We need to know the application fingerprint of our networks and users so that we can see when something is amiss. Security is fast becoming the front-lines for enterprises and one of the most strategic roles in any organization, but it requires us to be actively and intellectually engaged. That is a daunting task, but one we can meet.",https://www.securityweek.com/lessons-mandiant%E2%80%99s-apt1-report
2,APT1,"Lockheed: Attackers Went Quiet After APT1 Report Exposed Chinese Hackers


Lockheed Martin Says Attackers Went Quiet After Mandiant's APT1 Report Called Out Chinese Cyber Spies
Threat actors targeting Lockheed Martin immediately halted their cyberattacks against the defense contractor following the release of Mandiant’s APT1 report, Lockheed executives said Wednesday.
In February 2013, Mandiant released its bold, unprecedented report that made direct allegations and exposed a multi-year, massive cyber state-sponsored espionage campaign from a unit of China’s People’s Liberation Army (PLA).
The threat actor group, dubbed APT1 by FireEye-owned Mandiant, is alleged to be one of the most persistent of China's cyber threat actors, which the security firm claims has “systematically stolen hundreds of terabytes of data” from at least 141 organizations.
However, as Mandiant explained in a follow-up report released in May 2013, the threat actors immediately began curtailing their attacks after being called out and began to shift techniques, something that Lockheed witnessed in its own environment. 
“Since the Mandiant report came out, we saw an immediate decrease in attacks,” Charles “Charlie” Croom, VP of Cyber Strategy and Government Relations at Lockheed Martin Information Systems & Global Solutions, told SecurityWeek. “I think all our strategic partners saw that,” he said.
Speaking to SecurityWeek at the company’s Global Vision Center in Arlington, Virginia, Croom said the adversary that Mandiant exposed was one that a number of companies, including Lockheed Martin, had been tracking for over a year. “We were familiar with this adversary, and were familiar with their tactics and procedures,” he said.
“Because of the characteristics of the attacks, and who they are attacking, we know who the team is,” Croom said.
While Mandiant’s report was met with criticism by some, particularly around the challenges of attribution, it’s clear that the report had a significant impact and triggered a reaction from the alleged state sponsored threat actors.
“We’re glad Mandiant stood up,” Croom said.
“[The report] was a trigger point”, Darrell Durst, VP of Cyber Solutions at Lockheed Martin, said during a panel discussion at the Lockheed Martin Defense and Intelligence Technology Media Summit on Wednesday. “Things were dying down even before the report came out, but you could clearly see a shift in actions.”
Targeting Suppliers
While not necessarily as a result of the APT1 report, Croom, who while in the U.S. Air Force served as Director of the Defense Information Systems Agency (DISA) and Commander of the Joint Task Force for Global Network Operations, said that Lockheed’s hardened IT security infrastructure is forcing some attackers to find other means to attack.
“The good news is that they are not attacking Lockheed Martin any more because we are too hard, so they are going to our suppliers,” he said.
“The threat over the last ten years has gotten extremely aggressive,” Durst said. “[Attackers] are actually being very strategic in where it is that they want to get the information and how they are going to go about doing that.”
“They will wait,” Durst said, adding that attackers will take their time in order to get in and achieve their objectives.
“They will go to a supplier who has the connection to Lockheed Martin from an IT perspective, or even in a sharing of documentation,” Durst said.
While Durst says the defense giant has been successful in thwarting a number of attackers, he said new adversaries with new techniques continue to emerge and campaigns continue to increase.
“We have seen a number of the adversaries gone quiet,” he said. “I think we have successfully been able to counter a number of adversaries relative to our networks.""
While some attackers may have gone quiet, the company does not believe they have gone away for good, but have rather shifted tactics.
“Even if it were two years, that’s not necessarily an indication that they have gone away,” Durst said.
“We are assuming they are taking a different approach,” said Tim Reardon, Vice President and General Manager Lockheed’s Defense & Intelligence Solutions group.
While Lockheed did not specify the tactics used against them by the APT1 attackers, Mandiant’s report explained that the group used highly targeted spear-phishing techniques to infect a target, which included creating fake email accounts in the name of someone that the target would recognize.
When asked if they were able to trace the attacks back to China, Croom reiterated the company’s policy of non-attribution.
“We’re interested more in their attributes, and how their attributes can reveal them coming into our network so that we can spot them and kick them out.”
Related Reading:  Cyber Espionage Campaign Targeting Supply Chain Through Precision 'Hit and Run' Attacks",https://www.securityweek.com/lockheed-attackers-went-quiet-after-apt1-report-exposed-chinese-hackers
3,APT1,"Unit In China's PLA Behind Massive Cyber Espionage Operation: Report

APT1: Mandiant Exposes One of China's Most Active Cyber Espionage Units
In a fascinating, unprecedented, and statistics-packed report, security firm Mandiant made direct allegations and exposed a multi-year, massive cyber espionage campaign that they say with confidence is the work of China, more specifically, a unit of China’s People’s Liberation Army (PLA).
Mandiant has named the attack group “APT1”, what is likely a government-sponsored group that is one of the most persistent of China's cyber threat actors, and considered to be one of the most prolific in terms of quantity of information it has stolen.
To further its claims that there are actual individuals behind the keyboard, Mandiant also revealed three “personas” that they say are associated with APT1 attacks.
According to Mandiant’s investigations, APT1 has taken hundreds of terabytes of data from at least 141 organizations across many industries going as far back as 2006, but representing just a small fraction of the overall cyber espionage that APT1 has conducted.
It was the massive scale and impact of APT1's operations that compelled Mandiant to write and publically release the report.
Historically, Mandiant has said there was no way to determine the extent of China’s involvement in many attacks, but the firm now says it has enough evidence to confidently say that “the groups conducting these activities are based primarily in China and that the Chinese Government is aware of them.”
While many firms steer away from publicly calling out China as a culprit in cyber attacks, Mandiant is taking a stance and boldly pointing fingers at China, and bringing many statistics and research to back its case.
Mandiant believes APT1 is the 2nd Bureau of the People’s Liberation Army (PLA) General staff Department’s (GSD) 3rd Department, commonly known by its Military unit Cover Designator (MUCD) as Unit 61398.
The security firm estimates that Unit 61398 is staffed by hundreds, or even thousands of people, and that China Telecom provided special fiber optic communications infrastructure for the unit. Additionally, Mandiant said that it conservatively estimates that APT1’s current attack infrastructure includes over 1,000 servers across dozens of countries.
Mandiant said that it was able to confirm 937 command and control servers running on 849 distinct IP addresses and has confirmed 2,551 domain names attributed to APT1 in the last several years.
“Our research and observations indicate that the Communist Party of  China is tasking the Chinese People’s Liberation Army (PLA) to commit systematic cyber espionage and data theft against organizations around the world,” the report alleged.
When APT1 launches an attack against a target, it’s typically not a one shot deal or a quick hit. In fact, according to Mandiant’s research, APT1 maintained access to victim networks for an average of 356 days. The longest time period APT1 maintained access to a victim’s network was four years and ten months.
In one operation, Mandiant witnessed APT1 steal 6.5 terabytes of compressed data from a single organization over a ten-month time period. APT1’s targets include organizations across a broad range of industries, mainly in the United States and other English-speaking countries.

In over 97% of the 1,905 times Mandiant witnessed APT1 intruders connecting to their attack infrastructure, APT1 used IP addresses registered in Shanghai and systems set to use the Simplified Chinese language.
“Once the group establishes access to a victim’s network, they continue to access it periodically over several months or years  to steal large volumes of valuable intellectual property, including technology blueprints, proprietary manufacturing processes, test results, business plans, pricing documents, partnership agreements, emails and contact lists from victim organizations’ leadership,” the report explained.
Hacking For Economic Gain and Advantage
Mandiant’s investigations show that APT1 has targeted at least four of the seven strategic emerging industries that China identified in its 12th Five Year Plan, and warns that any industry related to China’s strategic priorities are potential attack targets.
Mandiant highlighted an attack in 2008 that compromised the network of a company involved in a wholesale industry. According to Mandiant, over the next two and a half years, APT1 used various tools to steal an unknown number of files from the victim and repeatedly accessed the email accounts of several executives, including the conpany's CEO and General Counsel. During this same time period, news organizations reported that China had successfully negotiated a double-digit decrease in price per unit with the victim organization for one of its major commodities, Mandiant said.
China continues to deny claims
As usual, China denied that its Army had supported any kind of hacking activity.
""Not only are reports that China's army has been involved in hacking unprofessional, they do not fit with the facts,"" China's defense ministry said in a statement to AFP. ""Hacking attacks are a global problem. Like other countries, China also faces the threat of hacking attacks, and is one of the main countries falling victim to hacking attacks.""
China’s foreign ministry also reminded that China was itself a major victim, saying that most overseas cyberattacks against it originate in the US.
Recent attacks against several high-profile US media outlets, Including The New York Times, The Wall Street Journal, The Washington Post, and Bloomberg, as well as against Twitter and others, have further raised concerns over Chinese hackers.
In late January, The New York Times said hackers stole corporate passwords and targeted the computers of 53 employees including former Beijing bureau chief Jim Yardley, who is now the South Asia bureau chief at the Times based in India, after the newspaper published a report on the vast wealth amassed by Premier Wen Jiabao's family.
Mandiant was hired to investigate the attacks against The Times. 
While Mandiant hopes its efforts will lead to increased understanding and coordinated action in countering targeted cyber attacks, it also acknowledged that releasing this report has put itself somewhat at risk.
“We are acutely aware of the risk this report poses for us,” Mandiant noted. “We expect reprisals from China as well as an onslaught of criticism.”
In addition to the detailed report, Mandiant provided more than 3,000 APT1 indicators of compromise, including domain names, IP addresses, X.509 encryption certificates and MD5 hashes of malware used by APT1's attackers, in order to help organizations identify and defend against APT1 operations.
The full report from Mandiant can be found here (PDF), and the Appendix and 3,000+ APT1 Indicators can be found here (.zip). Mandiant also provided a video showing actual APT1 activity which is embedded below.
This report is likely to be one of the most important reports of the year and should be required reading for any information security professional—or if it were up to me, everyone within an organization.
",https://www.securityweek.com/cyber-unit-chinas-pla-behind-massive-cyber-espionage-operation-report
4,APT1,"China's APT1 Changing Tactics, Rebuilding: Mandiant

It appears the Chinese cyber-espionage crew behind attacks on as many as 100 businesses is cutting back on some of its attacks and looking for alternative tools, Mandiant said.
Back in February, Mandiant released a 74-page report with loads of information on the group, dubbed APT1, including its attack methods, operational methodology, and organizations it had previously infiltrated. The report accused APT1 of retrieving hundreds of terabytes of stolen data. Even if APT1 wasn't an official entity within the Chinese government, the report made a strong case that the government was at least aware of its operations.

Since the publication of the report, the group may have had to change some of its methods, Mandiant said in a follow-up report this week. The original report included more than 3,000 APT1 indicators used by APT1, including domain names, 832 IP addresses, 13 digital certificates used to encrypt data, and MD5 hashes of over malware. Recent analysis indicates they are still active, but they are changing their methods.
""APT1 is still active using a well-coordinated and well-defined attack methodology against a wide set of industries -- with a discernible post-report shift towards new tools and infrastructure,"" wrote Dan Mcwhorter, Mandiant's managing director for threat intelligence.
The report was the first time a private sector company had laid out evidence to link the China to cyber-espionage campaigns against businesses and government entities around the world.
APT1 relied on social engineering methods, remote access tools, and more than 40 malware families to carry out their operations, the original report said. The report's goal was to make it harder to the group to carry out their attacks and slow them down, since organizations now knew what to look for in their logs and network traffic. It appears to have had some effect, as the information ""hindered APT1's operations,"" Mcwhorter wrote.
""APT1 has stopped using the vast majority of the infrastructure that was disclosed with the release of the indicators,"" Mcwhorter wrote.
The group has not been knocked out yet, as it probably still has access to an extensive infrastructure of computers around the world. While there was speculation that Mandiant's publication of APT1 indicators would have resulted in the group dismantling itself, the follow-up reports indicates that is not the case.
Mandiant noted that APT1 is only one of more than 20 Advanced Persistent Threat groups operating out of China that the company is aware of. Mandiant's report disrupted only APT1, not the others.
""Mandiant has observed no significant changes in their operations,"" the follow-up report said. 
Related Reading: Lessons from Mandiant's APT1",https://www.securityweek.com/chinas-apt1-changing-tactics-rebuilding-mandiant
